{
  "schema": "sourcefold.creature.v0",
  "id": "coc:creature:scarecrow",
  "kind": "creature",
  "name": {
    "ru": "Пугало",
    "en": "Scarecrow"
  },
  "aliases": [],
  "category": "supernatural",
  "subcategory": "анимированное создание",
  "axes": {
    "era": [
      "any"
    ],
    "ruleset": "core"
  },
  "statblock": {
    "averages": true,
    "characteristics": {
      "STR": {
        "raw": "50–55",
        "value": 50,
        "roll": "3d6×5"
      },
      "CON": {
        "raw": "105",
        "value": 105,
        "roll": "6d6×5"
      },
      "SIZ": {
        "raw": "65",
        "value": 65,
        "roll": "(2d6+6)×5"
      },
      "DEX": {
        "raw": "35",
        "value": 35,
        "roll": "2d6×5"
      },
      "INT": {
        "raw": "15",
        "value": 15,
        "roll": "1d6×5"
      },
      "POW": {
        "raw": "05",
        "value": 5,
        "roll": "05"
      }
    },
    "hp": {
      "raw": "17",
      "value": 17
    },
    "damage_bonus": {
      "raw": "0",
      "value": "0"
    },
    "build": {
      "raw": "0",
      "value": 0
    },
    "move": {
      "raw": "6",
      "value": 6,
      "modes": [
        {
          "mode": "walk",
          "value": 6
        }
      ]
    },
    "armor": {
      "raw": "2 пункта (солома и дерево); неуязвим к проникающим атакам; тупое оружие и рубящие атаки наносят половину урона; восприимчив к огню (1d6+2 урона за раунд); если не истощить МОЩ или не сжечь пугало полностью, оно может регенерировать/восстановиться за количество минут, равное ТЕЛ ×2.",
      "value": 2,
      "note": "иммунитет к проникающим атакам; тупое и рубящее оружие — половина урона; огонь — 1d6+2 урона за раунд"
    },
    "attacks_per_round": {
      "raw": "1 (бьёт, душит или использует оружие)",
      "value": 1
    },
    "attacks": [
      {
        "name": {
          "ru": "Ближний бой",
          "en": "Fighting"
        },
        "kind": "attack",
        "skill": "Ближний бой",
        "chance": {
          "raw": "35% (17/7)",
          "value": 35,
          "half": 17,
          "fifth": 7
        },
        "damage": {
          "raw": "1d4+БкУ",
          "dice": "1d4",
          "adds_db": true
        }
      },
      {
        "name": {
          "ru": "Удушение (м)",
          "en": "Strangle (m)"
        },
        "kind": "maneuver",
        "skill": "Ближний бой",
        "chance": {
          "raw": "35% (17/7)",
          "value": 35,
          "half": 17,
          "fifth": 7
        },
        "damage": {
          "raw": "1d4",
          "dice": "1d4",
          "adds_db": false,
          "extra": "по описанию манёвра — 1d4+БкУ за раунд, пока жертва не умрёт, не потеряет сознание или пугало не отбросят"
        },
        "notes": "вырваться — встречная проверка СИЛ; если помощники нанесут 10+ урона за раунд, пугало может ослабить хватку"
      },
      {
        "name": {
          "ru": "Серп",
          "en": "Sickle"
        },
        "kind": "attack",
        "skill": "Ближний бой",
        "chance": {
          "raw": "35% (17/7)",
          "value": 35,
          "half": 17,
          "fifth": 7
        },
        "damage": {
          "raw": "1d6+1+БкУ",
          "dice": "1d6+1",
          "adds_db": true
        }
      },
      {
        "name": {
          "ru": "Вилы",
          "en": "Pitchfork"
        },
        "kind": "attack",
        "skill": "Ближний бой",
        "chance": {
          "raw": "35% (17/7)",
          "value": 35,
          "half": 17,
          "fifth": 7
        },
        "damage": {
          "raw": "1d8+БкУ",
          "dice": "1d8",
          "adds_db": true
        }
      },
      {
        "name": {
          "ru": "Коса",
          "en": "Scythe"
        },
        "kind": "attack",
        "skill": "Ближний бой",
        "chance": {
          "raw": "35% (17/7)",
          "value": 35,
          "half": 17,
          "fifth": 7
        },
        "damage": {
          "raw": "1d10+БкУ",
          "dice": "1d10",
          "adds_db": true
        }
      }
    ],
    "dodge": {
      "raw": "17% (8/3)",
      "value": 17,
      "half": 8,
      "fifth": 3
    },
    "skills": [
      {
        "name": "Неустанно продвигаться",
        "value": {
          "raw": "100%",
          "value": 100
        }
      }
    ],
    "sanity_loss": [
      {
        "success": "0",
        "fail": "1d4+1",
        "trigger": "при виде ожившего пугала"
      }
    ]
  },
  "abilities": [
    {
      "name": "Удушение",
      "summary": "Смыкает руки на горле жертвы и наносит 1d4+БкУ урона за раунд; вырваться — встречная проверка СИЛ, 10+ урона за раунд от помощников может заставить ослабить хватку."
    },
    {
      "name": "Восстановление",
      "summary": "Если не истощить МОЩ и не сжечь полностью, восстанавливается за ТЕЛ ×2 минут."
    },
    {
      "name": "Уязвимость к огню",
      "summary": "Огонь наносит 1d6+2 урона за раунд."
    }
  ],
  "description": {
    "ru": "Ожившее соломенное пугало из дерева и тряпья, которое бьёт, душит или пускает в ход серп, вилы и косу.",
    "en": null
  },
  "sources": [
    {
      "book_id": "malleus-keeper-deck-en",
      "physical_page": 42,
      "printed_page": null,
      "method": "book_text",
      "verified": true
    },
    {
      "book_id": "malleus-monstrorum-1-en",
      "physical_page": 180,
      "printed_page": 179,
      "method": "book_text",
      "verified": true
    }
  ],
  "corrections": [],
  "quality": {
    "needs_review": true,
    "flags": [
      "parse_uncertain"
    ],
    "notes": "МОЩ на карточке напечатана как «05» и в столбце броска, и в столбце среднего; смысл неясен (возможно, 0×5 или 0). В value записано 5 как первое число записи.; в «Книге хранителя» статблока нет; источник — только Malleus Keeper Deck"
  }
}
