{
  "schema": "sourcefold.creature.v0",
  "id": "coc:creature:people-of-kn-yan",
  "kind": "creature",
  "name": {
    "ru": "Народ К'н-яна",
    "en": "People of K’n-yan"
  },
  "aliases": [
    "K’n-yanians",
    "Old Ones",
    "Tulu People",
    "Under-dwellers"
  ],
  "category": "mythos_monster",
  "subcategory": "независимая раса",
  "axes": {
    "era": [
      "any"
    ],
    "ruleset": "core"
  },
  "statblock": {
    "averages": true,
    "characteristics": {
      "STR": {
        "raw": "60",
        "value": 60,
        "roll": "(2d6+5)×5"
      },
      "CON": {
        "raw": "60",
        "value": 60,
        "roll": "(2d6+5)×5"
      },
      "SIZ": {
        "raw": "65",
        "value": 65,
        "roll": "(2d6+6)×5"
      },
      "DEX": {
        "raw": "65",
        "value": 65,
        "roll": "(2d6+6)×5"
      },
      "APP": {
        "raw": "60",
        "value": 60,
        "roll": "(2d6+5)×5"
      },
      "INT": {
        "raw": "90",
        "value": 90,
        "roll": "(2d6+11)×5"
      },
      "POW": {
        "raw": "80",
        "value": 80,
        "roll": "(2d6+9)×5"
      },
      "EDU": {
        "raw": "95",
        "value": 95,
        "roll": "(2d6+12)×5"
      }
    },
    "hp": {
      "raw": "12",
      "value": 12
    },
    "mp": {
      "raw": "16",
      "value": 16
    },
    "damage_bonus": {
      "raw": "+1d4",
      "value": "1d4"
    },
    "build": {
      "raw": "1",
      "value": 1
    },
    "move": {
      "raw": "8",
      "value": 8,
      "modes": [
        {
          "mode": "walk",
          "value": 8
        }
      ]
    },
    "armor": {
      "raw": "нет; может дематериализоваться (тогда физические атаки не наносят урона).",
      "value": 0
    },
    "attacks_per_round": {
      "raw": "1 (безоружная атака, оружие или психическая атака)",
      "value": 1
    },
    "attacks": [
      {
        "name": {
          "ru": "Ближний бой",
          "en": "Fighting"
        },
        "kind": "attack",
        "skill": "Ближний бой",
        "chance": {
          "raw": "40% (20/8), урон 1d3+БкУ или по типу оружия",
          "value": 40,
          "half": 20,
          "fifth": 8
        },
        "damage": {
          "raw": "урон 1d3+БкУ или по типу оружия",
          "dice": "1d3",
          "adds_db": true
        },
        "notes": "может пользоваться любым человеческим оружием; цивилизованные жители предпочитают мечи и дезинтеграторы"
      },
      {
        "name": {
          "ru": "Психическая атака",
          "en": "Psychic Attack"
        },
        "kind": "special",
        "skill": "МОЩ (встречная проверка)",
        "chance": {
          "value": null,
          "half": null,
          "fifth": null,
          "raw": "встречная проверка МОЩ с целью, урон 1d10 пунктов магии"
        },
        "damage": {
          "raw": "урон 1d10 пунктов магии",
          "dice": "1d10",
          "adds_db": false,
          "extra": "урон по пунктам магии; при 0 ПМ цель теряет сознание"
        },
        "notes": "встречная проверка МОЩ против цели вместо атаки"
      },
      {
        "name": {
          "ru": "Дезинтегрирующий излучатель",
          "en": "Disintegration-ray"
        },
        "kind": "attack",
        "skill": "Стрельба",
        "chance": {
          "raw": "35% (17/7), урон 1d10",
          "value": 35,
          "half": 17,
          "fifth": 7
        },
        "damage": {
          "raw": "урон 1d10",
          "dice": "1d10",
          "adds_db": false
        },
        "notes": "дальность 20 м; раны прижигаются, потерянные ПЗ теряются навсегда (кроме магического или технологического лечения), по решению Хранителя возможна потеря НАР; при выпадении 100 излучатель взрывается и стрелок получает 8d10 урона"
      }
    ],
    "dodge": {
      "raw": "32% (16/6)",
      "value": 32,
      "half": 16,
      "fifth": 6
    },
    "skills": [
      {
        "name": "Мифы Ктулху",
        "value": {
          "raw": "20%",
          "value": 20,
          "half": 10,
          "fifth": 4
        }
      },
      {
        "name": "Дематериализация",
        "value": {
          "raw": "45%",
          "value": 45,
          "half": 22,
          "fifth": 9
        }
      },
      {
        "name": "Знание снов",
        "value": {
          "raw": "20%",
          "value": 20,
          "half": 10,
          "fifth": 4
        }
      },
      {
        "name": "Знание (К'н-ян)",
        "value": {
          "raw": "50%",
          "value": 50,
          "half": 25,
          "fifth": 10
        }
      },
      {
        "name": "Телепатия",
        "value": {
          "raw": "80%",
          "value": 80,
          "half": 40,
          "fifth": 16
        }
      }
    ],
    "spells": {
      "raw": "1d6 заклинаний на выбор Хранителя."
    },
    "sanity_loss": [
      {
        "success": "0",
        "fail": "0",
        "trigger": "при встрече с жителями К'н-яна (потери рассудка нет)"
      }
    ]
  },
  "abilities": [
    {
      "name": "Телепатия",
      "summary": "Общаются мысленно (навык 60–80%). Между собой — через зрительный контакт; со знакомыми телепатами и рабами — без контакта за 1d4 ПМ в час на расстоянии до 30 м. Не-телепат слышит послание только при контакте глаз и успешной проверке МОЩ."
    },
    {
      "name": "Дематериализация",
      "summary": "Себя или проекцию сна — за 1d8 ПМ; предметы и существа — за 1d8+2 ПМ (против воли цели — встречная проверка МОЩ). Дематериализация стоит цели 1d6 рассудка. Можно ранить, материализуя предмет внутри тела или жертву в стене (1d10–2d10 урона); в бою занимает три раунда."
    },
    {
      "name": "Психическая атака",
      "summary": "Встречная проверка МОЩ: цель теряет 1d10 ПМ и падает без сознания при 0 ПМ."
    },
    {
      "name": "Почти бессмертие",
      "summary": "Умирают только от неестественных причин (например, от насилия) и умеют возвращать мёртвых к жизни."
    }
  ],
  "description": {
    "ru": "Высокие худощавые гуманоиды с медной кожей, длинными узкими лицами и вытянутыми мочками ушей, живущие в подземной империи К'н-ян, освещённой голубым светом. Это древняя угасающая цивилизация телепатов, которые ищут новых ощущений в пытках, жестоких играх, дурманах и долгих снах.",
    "en": null
  },
  "legend": {
    "ru": "Некоторые источники утверждают, что народ К'н-яна пришёл со звёзд вместе с Ктулху (Тулу), и многие считают себя его потомками. Почитают также Йига, Нуга и Йеба, Шуб-Ниггурат, Гатанотоа и Хастура. Около времени гибели Атлантиды они отгородились от жителей поверхности, и с тех пор их знания во многом утрачены, а рождаемость почти исчезла.",
    "en": null
  },
  "habitat": "подземная империя К'н-ян; ходы на поверхность — в районе Оклахомы, а также вниз, в бездну Н'кай, и, вероятно, в Страну снов",
  "sources": [
    {
      "book_id": "malleus-monstrorum-1-en",
      "physical_page": 89,
      "printed_page": 88,
      "method": "book_text",
      "verified": true
    }
  ],
  "corrections": [],
  "quality": {
    "needs_review": false,
    "flags": [
      "translated"
    ],
    "notes": "Профиль описывает «цивилизованного» жителя К'н-яна; у атаки «Дезинтегрирующий излучатель» навык в книге не указан, в записи — Стрельба."
  }
}
