{
  "schema": "sourcefold.creature.v0",
  "id": "coc:creature:spawn-of-yog-sothoth-monster",
  "kind": "creature",
  "name": {
    "ru": "Порождение Йог-Сотота (монстр)",
    "en": "Spawn of Yog-Sothoth, Monster"
  },
  "aliases": [],
  "category": "mythos_monster",
  "subcategory": "порождение Великого Древнего",
  "axes": {
    "era": [
      "any"
    ],
    "ruleset": "core"
  },
  "statblock": {
    "averages": true,
    "characteristics": {
      "STR": {
        "raw": "175",
        "value": 175,
        "roll": "2d6×25"
      },
      "CON": {
        "raw": "175",
        "value": 175,
        "roll": "2d6×25"
      },
      "SIZ": {
        "raw": "220",
        "value": 220,
        "roll": "(4d6+30)×5"
      },
      "DEX": {
        "raw": "80",
        "value": 80,
        "roll": "(4d6+2)×5"
      },
      "INT": {
        "raw": "105",
        "value": 105,
        "roll": "6d6×5"
      },
      "POW": {
        "raw": "105",
        "value": 105,
        "roll": "6d6×5"
      }
    },
    "hp": {
      "raw": "39",
      "value": 39
    },
    "mp": {
      "raw": "21",
      "value": 21
    },
    "damage_bonus": {
      "raw": "+4d6",
      "value": "4d6"
    },
    "build": {
      "raw": "5",
      "value": 5
    },
    "move": {
      "raw": "10",
      "value": 10,
      "modes": [
        {
          "mode": "walk",
          "value": 10
        }
      ]
    },
    "armor": {
      "raw": "нет; отродью нельзя навредить обычным оружием, а зачарованное оружие наносит минимально возможный урон; чудовищные отродья невидимы.",
      "value": 0,
      "note": "обычное оружие не вредит; зачарованное — минимальный урон"
    },
    "attacks_per_round": {
      "raw": "6 (щупальца, хватает и бьёт)",
      "value": 6
    },
    "attacks": [
      {
        "name": {
          "ru": "Ближний бой",
          "en": "Fighting"
        },
        "kind": "attack",
        "skill": "Ближний бой",
        "chance": {
          "raw": "90% (47/18)",
          "value": 90,
          "half": 47,
          "fifth": 18
        },
        "damage": {
          "raw": "1d6+БкУ",
          "dice": "1d6",
          "adds_db": true
        },
        "notes": "удары щупальцами; половина напечатана на карточке как 47"
      },
      {
        "name": {
          "ru": "Захват (м)",
          "en": "Grab (m)"
        },
        "kind": "maneuver",
        "skill": "Ближний бой",
        "chance": {
          "raw": "40% (20/8)",
          "value": 40,
          "half": 20,
          "fifth": 8
        },
        "damage": {
          "raw": "захват, затем раздавить (урон равен БкУ) или высосать кровь (1d10 урона + потеря 1d10 ВЫН за раунд)",
          "dice": "1d10",
          "adds_db": false,
          "extra": "или раздавливание с уроном, равным БкУ; высасывание — ещё потеря 1d10 ВЫН за раунд"
        },
        "notes": "до трёх щупалец на одну цель: одна проверка атаки с двумя бонусными костями; вырваться — встречная проверка ЛВК или СИЛ каждый раунд"
      }
    ],
    "dodge": {
      "raw": "40% (20/8)",
      "value": 40,
      "half": 20,
      "fifth": 8
    },
    "skills": [],
    "spells": {
      "raw": "с вероятностью 20% знает 1d6 заклинаний."
    },
    "sanity_loss": [
      {
        "success": "1d4",
        "fail": "1d8+2",
        "trigger": "при виде порождения"
      }
    ]
  },
  "abilities": [
    {
      "name": "Невидимость (опционально)",
      "summary": "Некоторых чудовищных порождений нельзя увидеть без магии; атакующий получает штрафную кость на попадание."
    },
    {
      "name": "Неуязвимость к обычному оружию",
      "summary": "Обычное оружие не вредит; зачарованное наносит минимально возможный урон."
    },
    {
      "name": "Захват щупальцами",
      "summary": "Схватив цель, раздавливает её (урон равен БкУ) или высасывает кровь (1d10 урона + 1d10 ВЫН за раунд)."
    }
  ],
  "description": {
    "ru": "Огромное чудовищное порождение Йог-Сотота со множеством щупалец, которые бьют, хватают, давят и высасывают кровь; часто невидимо.",
    "en": null
  },
  "sources": [
    {
      "book_id": "malleus-keeper-deck-en",
      "physical_page": 57,
      "printed_page": null,
      "method": "book_text",
      "verified": true
    }
  ],
  "corrections": [
    {
      "field": "statblock.attacks[0].chance",
      "from": "90% (45/18)",
      "to": "90% (47/18)",
      "reason": "значение по карточке Malleus Keeper Deck (решение владельца Р-19)",
      "ref": "malleus-keeper-deck-en p.57"
    }
  ],
  "quality": {
    "needs_review": true,
    "flags": [
      "parse_uncertain"
    ],
    "notes": "На карточке у Ближнего боя напечатано 90% (47/18); половина 90 — 45, вероятно опечатка карточки. Записано как на карточке (решение Р-19).; в «Книге хранителя» статблока нет; источник — только Malleus Keeper Deck"
  }
}
