{
  "schema": "sourcefold.creature.v0",
  "id": "coc:creature:kruschtya-equation",
  "kind": "creature",
  "name": {
    "ru": "Уравнение Круштьи",
    "en": "The Kruschtya Equation"
  },
  "aliases": [
    "Cosmic Principle",
    "Devil's Therum"
  ],
  "category": "avatar",
  "subcategory": "аватар Ньярлатхотепа",
  "axes": {
    "era": [
      "any"
    ],
    "ruleset": "core"
  },
  "statblock": {
    "characteristics": {
      "STR": {
        "raw": "n/a",
        "value": null
      },
      "CON": {
        "raw": "n/a",
        "value": null
      },
      "SIZ": {
        "raw": "n/a",
        "value": null
      },
      "DEX": {
        "raw": "n/a",
        "value": null
      },
      "INT": {
        "raw": "430",
        "value": 430
      },
      "POW": {
        "raw": "500",
        "value": 500
      }
    },
    "averages": false,
    "hp": {
      "raw": "n/a",
      "value": null,
      "note": "ПЗ, СИЛ, ВЫН, ТЕЛ, ЛВК и Движение — как у решившего уравнение"
    },
    "mp": {
      "raw": "100",
      "value": 100
    },
    "damage_bonus": {
      "raw": "n/a",
      "value": null
    },
    "build": {
      "raw": "n/a",
      "value": null
    },
    "move": {
      "raw": "n/a",
      "value": null,
      "modes": []
    },
    "attacks": [],
    "skills": [],
    "spells": {
      "raw": "any the Keeper desires, but none concerning Elder God and associated matters."
    },
    "sanity_loss": [
      {
        "success": "1d10",
        "fail": "1d100",
        "trigger": "тому, кто решил уравнение"
      }
    ]
  },
  "abilities": [
    {
      "name": "Решение уравнения",
      "summary": "Нужен ИНТ 90+. Решающий изучает уравнение (365 − ОБР) дней, затем делает чрезвычайную проверку ИНТ или Математики; при неудаче начинает заново, но срок вдвое короче."
    },
    {
      "name": "Одержимость",
      "summary": "За каждую неделю работы — накопительно 1% шанс одержимости: 1 пункт рассудка в день до решения или безумия, штрафная кость на посторонние навыки. Коллега может помочь трудным Психоанализом или Убеждением, после чего одержимый проходит проверку МОЩ; попытка раз в неделю."
    },
    {
      "name": "Полное решение",
      "summary": "Решённое уравнение оказывается заклинанием призыва: Ньярлатхотеп вселяется в решившего — ИНТ становится 430, МОЩ 500, ОБР утраивается, рассудок падает до 0; физические характеристики и ПЗ остаются прежними. Убийство носителя изгоняет бога; Изгнание беса и подобные заклинания могут выгнать его, сохранив тело, но разум, скорее всего, потерян."
    }
  ],
  "description": {
    "ru": "Сложнейшее квантово-математическое уравнение, решение которого призывает Ньярлатхотепа в тело решившего.",
    "en": null
  },
  "legend": {
    "ru": "Известно ми-го, шан, йитианам и, возможно, жителям К'ньяна; в томах встречается как «Космический принцип» или «Теорема дьявола». Легенда гласит, что профессор Гюнтер Круштья, одержимый решением, был уволен и исчез вместе с работой, вероятно, в пожаре; его историей вдохновлена Группа Круштьи из учёных и энтузиастов.",
    "en": null
  },
  "cult": {
    "ru": "Культ — Группа Круштьи. Уравнению не поклоняются, как другим аватарам, но его знают развитые инопланетные расы (ми-го, шан, йитиане), а возможно, и жители К'ньяна; всех их объединяет вера, что решение даёт власть. Оно упоминается в немногих томах (иногда как «Космический принцип» или «Теорема дьявола») как задача, заданная богом: решивший её сам станет богом. Среди математиков ходит легенда о профессоре Гюнтере Круштье, одержимом уравнением и исчезнувшем вместе с работой (вероятно, в пожаре); вдохновлённые ею учёные и энтузиасты-любители называют себя Группой Круштьи и пытаются найти и решить уравнение — пока безуспешно.",
    "en": null
  },
  "sources": [
    {
      "book_id": "malleus-monstrorum-2-en",
      "physical_page": 161,
      "printed_page": 160,
      "method": "book_text",
      "verified": true
    },
    {
      "book_id": "malleus-monstrorum-2-en",
      "physical_page": 165,
      "printed_page": 164,
      "method": "book_text",
      "verified": true
    }
  ],
  "corrections": [],
  "quality": {
    "needs_review": false,
    "flags": [
      "translated"
    ],
    "notes": "В общей таблице аватаров (стр. 164 печатн., 165 PDF) все значения «n/a»: аватар проявляется через тело решившего. ИНТ 430 и МОЩ 500 — из описания «Full Solution»; ПМ 100 и заклинания — общие атрибуты всех аватаров. Название-синоним «Devil's Therum» оставлено как напечатано (вероятно, опечатка вместо «Theorem»)."
  }
}
