{
  "schema": "sourcefold.creature.v0",
  "id": "coc:creature:ghroth",
  "kind": "creature",
  "name": {
    "ru": "Грот",
    "en": "Ghroth"
  },
  "aliases": [
    "Doom Maker",
    "the Harbinger",
    "Nemesis",
    "World Killer",
    "Nemesis Star",
    "Planet Killer"
  ],
  "category": "mythos_deity",
  "subcategory": "Внешний бог",
  "axes": {
    "era": [
      "any"
    ],
    "ruleset": "core"
  },
  "statblock": {
    "characteristics": {
      "STR": {
        "raw": "n/a",
        "value": null
      },
      "CON": {
        "raw": "n/a",
        "value": null
      },
      "SIZ": {
        "raw": "n/a",
        "value": null
      },
      "DEX": {
        "raw": "n/a",
        "value": null
      },
      "POW": {
        "raw": "500",
        "value": 500
      }
    },
    "averages": false,
    "hp": {
      "raw": "n/a",
      "value": null
    },
    "mp": {
      "raw": "100",
      "value": 100
    },
    "damage_bonus": {
      "raw": "n/a",
      "value": null
    },
    "build": {
      "raw": "n/a",
      "value": null
    },
    "move": {
      "raw": "n/a",
      "value": null,
      "modes": []
    },
    "armor": {
      "raw": "None. Theoretically, if the power to destroy a planet was directed at Ghroth it could conceivably damage or kill this entity, causing it to shatter in an explosion of rock, iron, dust, and other materials (which on their own may cause large-scale planetary devastation). Possibly, somehow reducing Ghroth’s POW to zero would cause the entity to cease to exist or become a lifeless planet. If destroyed, Ghroth reforms inside Azathoth in 1,000 years, who then rebirths the entity so it may continue its mission to repair/reorder the cosmos.",
      "value": 0,
      "note": "повредить можно лишь силой, способной уничтожить планету, или сведя МОЩ к нулю; уничтоженный воссоздаётся внутри Азатота через 1000 лет"
    },
    "attacks_per_round": {
      "raw": "n/a",
      "value": null
    },
    "attacks": [],
    "skills": [],
    "spells": {
      "raw": "none."
    },
    "sanity_loss": [
      {
        "success": "1d10",
        "fail": "1d100",
        "trigger": "при виде Грота"
      },
      {
        "success": "1d10",
        "fail": "1d100",
        "trigger": "услышав Музыку сфер"
      }
    ]
  },
  "abilities": [
    {
      "name": "Космическая перестройка",
      "summary": "Сдвигает планеты на новые орбиты, разрушает их, гасит и зажигает звёзды; одно его присутствие может уничтожить планету."
    },
    {
      "name": "Музыка сфер",
      "summary": "Бесконечная песнь, пробуждающая мёртвых и спящих богов и порождающая странную жизнь; услышавший проверяет Рассудок (1d10/1d100)."
    },
    {
      "name": "Предвестие конца",
      "summary": "Перед его приближением обитатели планеты получают предчувствия катастрофы; одни впадают в отчаяние, другие готовят ему путь жестокими деяниями."
    }
  ],
  "description": {
    "ru": "Красная звезда размером с планету из живого газа, пепла и расплавленного железа, покрытая трещинами, под которыми скрыты беспокойные моря, с единственным огромным глазом.",
    "en": null
  },
  "legend": {
    "ru": "Странствует в пустоте и уничтожил планеты Елитка, Мормол и Шаггаи; возможно, вызвал вымирание на рубеже мела и палеогена. Его песнь будит Великих Древних и «ставит звёзды как надо». Почитают его астрологи и ждущие конца света, например Культ Грота в окрестностях Гоутсвуда; ми-го им заинтересованы, шаны его боятся. Связь с Азатотом — творец и разрушитель — остаётся догадкой.",
    "en": null
  },
  "aura": {
    "ru": "Обречённость, обречённость и снова обречённость. Неизбежное разрушение, ничтожность и бессилие.",
    "en": null
  },
  "encounters": {
    "ru": "Если Грот не летит к Земле, человечество может спать спокойно (почти). Обычно с ним сталкиваются через астрономию: в телескоп можно заметить, как он проходит через Солнечную систему (и, быть может, его огромный глаз, смотрящий в ответ), или уловить странные сигналы в радиоастрономии. Путешествующие магическими или сверхнаучными средствами могут оказаться не в том месте — даже на планете, которую вот-вот уничтожат. На Земле можно встретить бежавших от Грота чужаков, например шан.",
    "en": null
  },
  "cult": {
    "ru": "У Грота немного почитателей среди людей — в основном чародеи-астрологи и те, кто приветствует конец света. Одна небольшая, но организованная группа — Культ Грота (Cult of Ghroth) в окрестностях Гоутсвуда в Англии — пытается постичь смысл прохождения Грота; его члены уверены в своей грядущей смерти и не боятся её, поэтому действуют без оглядки на собственную безопасность, веря, что возродятся, когда Грот вернётся к Земле. Ми-го, говорят, очарованы Гротом и, вероятно, ставят опыты, чтобы понять его цель и даже как-то использовать его мощь. Шаны же, чью родную планету, по преданию, он уничтожил, боятся Грота и при его возвращении, вероятно, попытаются бежать с планеты или использовать человечество ради собственного выживания.",
    "en": null
  },
  "blessings": {
    "ru": "Конец близок: когда Грот приближается к планете, некоторые её обитатели получают предчувствия грядущей катастрофы — в виде слуховых галлюцинаций, снов, видений наяву и т. п. У одних эти предчувствия поглощают разум и толкают на всё более решительные действия, других охватывает уныние, а кто-то достигает своего рода просветления: постигает приближение Грота и посвящает себя подготовке его пути самыми отвратительными и жестокими деяниями",
    "en": null
  },
  "habitat": "космическая пустота",
  "sources": [
    {
      "book_id": "malleus-monstrorum-2-en",
      "physical_page": 89,
      "printed_page": 88,
      "method": "book_text",
      "verified": true
    }
  ],
  "corrections": [],
  "quality": {
    "needs_review": false,
    "flags": [
      "translated"
    ],
    "notes": "В книге: «Ghroth is beyond all scales of magnitude» — почти все значения n/a. Блок «Magic» и способности — на стр. 89 (PDF 90)."
  }
}
