{
  "schema": "sourcefold.creature.v0",
  "id": "coc:creature:devil-s-weed-devil-plant",
  "kind": "creature",
  "name": {
    "ru": "Дьявольское растение",
    "en": "Devil’s Weed / Devil Plant"
  },
  "aliases": [],
  "category": "mythos_monster",
  "subcategory": "растение-чудовище",
  "axes": {
    "era": [
      "any"
    ],
    "ruleset": "core"
  },
  "statblock": {
    "averages": true,
    "characteristics": {
      "STR": {
        "raw": "100",
        "value": 100,
        "roll": "(4d6+6)×5"
      },
      "CON": {
        "raw": "70",
        "value": 70,
        "roll": "4d6×5"
      },
      "SIZ": {
        "raw": "80",
        "value": 80,
        "roll": "(4d6+2)×5"
      },
      "DEX": {
        "raw": "65",
        "value": 65,
        "roll": "(2d6+6)×5"
      },
      "INT": {
        "raw": "25",
        "value": 25,
        "roll": "2d4×5"
      },
      "POW": {
        "raw": "70",
        "value": 70,
        "roll": "4d6×5"
      }
    },
    "hp": {
      "raw": "15",
      "value": 15
    },
    "mp": {
      "raw": "14",
      "value": 14
    },
    "damage_bonus": {
      "raw": "+1d6",
      "value": "1d6"
    },
    "build": {
      "raw": "2",
      "value": 2
    },
    "move": {
      "raw": "3",
      "value": 3,
      "modes": [
        {
          "mode": "walk",
          "value": 3
        }
      ]
    },
    "armor": {
      "raw": "нет; непроникающее оружие/пули наносят минимальный урон; проникающее оружие наносит обычный урон; устойчиво к огню и электричеству; токсичные химикаты губительны (1d6 урона за раунд).",
      "value": 0,
      "note": "непроникающее оружие и пули — минимальный урон"
    },
    "attacks_per_round": {
      "raw": "1d4 (кнут-лоза, укус, захват)",
      "value": "1d4"
    },
    "attacks": [
      {
        "name": {
          "ru": "Хлёст лозой или укус",
          "en": null
        },
        "kind": "attack",
        "skill": "Ближний бой",
        "chance": {
          "raw": "60% (30/12)",
          "value": 60,
          "half": 30,
          "fifth": 12
        },
        "damage": {
          "raw": "урон 1d6+БкУ",
          "dice": "1d6",
          "adds_db": true
        },
        "notes": "при нескольких атаках по одной цели получает бонусную кость за каждую атаку после первой"
      },
      {
        "name": {
          "ru": "Захват (манёвр)",
          "en": null
        },
        "kind": "maneuver",
        "skill": "Ближний бой",
        "chance": {
          "raw": "как Ближний бой",
          "value": 60,
          "half": 30,
          "fifth": 12
        },
        "damage": {
          "raw": "удушение или укус 1d6 за раунд",
          "dice": "1d6",
          "adds_db": false
        },
        "notes": "процент на карточке отдельно не указан; одна лоза имеет 4 ПЗ; схваченная жертва получает штрафную кость на атаки, при двух и более лозах — две; вырваться — встречная проверка СИЛ или ЛВК против СИЛ растения"
      }
    ],
    "dodge": {
      "raw": "32% (16/6)",
      "value": 32,
      "half": 16,
      "fifth": 6
    },
    "skills": [
      {
        "name": "Обнаружить добычу",
        "value": {
          "raw": "60%",
          "value": 60
        }
      }
    ],
    "spells": {
      "raw": "нет."
    },
    "sanity_loss": [
      {
        "success": "0",
        "fail": "1d6",
        "trigger": "при виде дьявольского растения"
      }
    ]
  },
  "abilities": [
    {
      "name": "Обвивающие лозы",
      "summary": "Каждый манёвр захвата добавляет обвивающую лозу; одна лоза имеет 4 ПЗ и может быть отрублена. Схваченную жертву душат или кусают (1d6 урона за раунд)."
    },
    {
      "name": "Стойкость",
      "summary": "Непроникающее оружие и пули наносят минимальный урон; устойчиво к огню и электричеству, но токсичные химикаты наносят 1d6 урона за раунд."
    },
    {
      "name": "Семя-паразит",
      "summary": "Семя инертно, пока его не проглотит живое существо; за 2d6 дней оно прорастает внутри носителя и вырывается наружу, убивая его. Признаки — потеря аппетита и расстройство желудка; осмотр врача может выявить паразита. Хирургическое удаление грозит носителю 2d6 урона, а почти созревшее растение может вырваться через первый же разрез и сожрать хирурга."
    },
    {
      "name": "Посадка семени",
      "summary": "На усмотрение Хранителя может вместо убийства «посадить» в схваченную жертву семя и отпустить её."
    },
    {
      "name": "Территориальность",
      "summary": "Обычно остаётся на месте своего рождения (может ползти по земле и взбираться по стенам) и нападает на всё, что приблизится на двадцать шагов; переместить его может лишь тот, кто знает команды управления."
    },
    {
      "name": "Чудовищный экземпляр",
      "summary": "Второй столбец блока: СИЛ 150, ВЫН 120, ТЕЛ 500, ЛВК 30, ИНТ 30, МОЩ 120; ПЗ 62, БкУ +6d6, комплекция 7, ПМ 24, атак за раунд 2d4; лоза имеет 4–8 ПЗ. Рассудок 1/1d8."
    }
  ],
  "description": {
    "ru": "Хищное растение с хлещущими и кусающими лозами, которые хватают и душат добычу.",
    "en": null
  },
  "sources": [
    {
      "book_id": "malleus-keeper-deck-en",
      "physical_page": 15,
      "printed_page": null,
      "method": "book_text",
      "verified": true,
      "note": "на карточке существо названо Devil Creeper; в «Книге хранителя» статблока нет — характеристики по Malleus Keeper Deck"
    },
    {
      "book_id": "malleus-monstrorum-1-en",
      "physical_page": 59,
      "printed_page": 58,
      "method": "book_text",
      "verified": true
    }
  ],
  "corrections": [],
  "quality": {
    "needs_review": false,
    "flags": [
      "translated"
    ],
    "notes": null
  }
}
