{
  "schema": "sourcefold.creature.v0",
  "id": "coc:creature:wolf",
  "kind": "creature",
  "name": {
    "ru": "Волк",
    "en": "Wolf"
  },
  "aliases": [
    "Волки"
  ],
  "category": "animal",
  "subcategory": "наземный хищник",
  "axes": {
    "era": [
      "any"
    ],
    "ruleset": "core"
  },
  "statblock": {
    "averages": true,
    "characteristics": {
      "STR": {
        "raw": "65",
        "value": 65,
        "roll": "(2d6+6)×5"
      },
      "CON": {
        "raw": "50",
        "value": 50,
        "roll": "3d6×5"
      },
      "SIZ": {
        "raw": "40",
        "value": 40,
        "roll": "(2d6+1)×5"
      }
    },
    "hp": {
      "raw": "9",
      "value": 9
    },
    "damage_bonus": {
      "raw": "нет",
      "value": null
    },
    "build": {
      "raw": "0",
      "value": 0
    },
    "move": {
      "raw": "12",
      "value": 12,
      "modes": [
        {
          "mode": "walk",
          "value": 12
        }
      ]
    },
    "armor": {
      "raw": "1 пункт (шерсть)",
      "value": 1,
      "note": "шерсть"
    },
    "attacks_per_round": {
      "raw": "1",
      "value": 1
    },
    "attacks": [
      {
        "name": {
          "ru": "Зубы, когти и терзание",
          "en": null
        },
        "kind": "attack",
        "skill": "Ближний бой",
        "chance": {
          "raw": "50% (25/10)",
          "value": 50,
          "half": 25,
          "fifth": 10
        },
        "damage": {
          "raw": "1d8 + БкУ",
          "dice": "1d8",
          "adds_db": true
        }
      }
    ],
    "dodge": {
      "raw": "32% (16/6)",
      "value": 32,
      "half": 16,
      "fifth": 6
    },
    "skills": [
      {
        "name": "Чтение следов (по запаху)",
        "value": {
          "raw": "90%",
          "value": 90
        }
      },
      {
        "name": "Внимание",
        "value": {
          "raw": "60%",
          "value": 60
        }
      }
    ],
    "sanity_loss": []
  },
  "description": {
    "ru": "Волки часто охотятся стаей на стада лосей или оленей, но выходят на охоту и в одиночку или семейной парой. Обычно избегают людей.",
    "en": null
  },
  "habitat": "примерно в тех же областях холодных и умеренных широт, что и крупные жвачные животные",
  "sources": [
    {
      "book_id": "keeper-rulebook-ru",
      "physical_page": 313,
      "printed_page": 334,
      "method": "book_text",
      "verified": true
    }
  ],
  "corrections": [],
  "quality": {
    "needs_review": false,
    "flags": []
  }
}
