{
  "schema": "sourcefold.creature.v0",
  "id": "coc:creature:shark-great-white",
  "kind": "creature",
  "name": {
    "ru": "Большая белая акула",
    "en": "Great White Shark"
  },
  "aliases": [],
  "category": "animal",
  "subcategory": "зверь",
  "form_of": [
    "coc:creature:shark"
  ],
  "axes": {
    "era": [
      "any"
    ],
    "ruleset": "core"
  },
  "statblock": {
    "averages": true,
    "characteristics": {
      "STR": {
        "raw": "210",
        "value": 210,
        "roll": "(6d6+21)×5"
      },
      "CON": {
        "raw": "175",
        "value": 175,
        "roll": "(6d6+14)×5"
      },
      "SIZ": {
        "raw": "220",
        "value": 220,
        "roll": "(6d6+23)×5"
      },
      "DEX": {
        "raw": "65",
        "value": 65,
        "roll": "(2d6+6)×5"
      },
      "POW": {
        "raw": "65",
        "value": 65,
        "roll": "(2d6+6)×5"
      }
    },
    "hp": {
      "raw": "39",
      "value": 39
    },
    "damage_bonus": {
      "raw": "+4d6",
      "value": "4d6"
    },
    "build": {
      "raw": "5",
      "value": 5
    },
    "move": {
      "raw": "11 swimming",
      "value": 11,
      "modes": [
        {
          "mode": "swim",
          "value": 11
        }
      ]
    },
    "armor": {
      "raw": "6-point skin",
      "value": 6,
      "note": "шкура"
    },
    "attacks_per_round": {
      "raw": "1 (bite, slam, bite and hold)",
      "value": 1
    },
    "attacks": [
      {
        "name": {
          "ru": "Ближний бой",
          "en": "Fighting"
        },
        "kind": "attack",
        "skill": "Ближний бой",
        "chance": {
          "raw": "70% (35/14), damage 2d6",
          "value": 70,
          "half": 35,
          "fifth": 14
        },
        "damage": {
          "raw": "2d6",
          "dice": "2d6",
          "adds_db": false
        }
      },
      {
        "name": {
          "ru": "Укус с захватом",
          "en": "Bite/hold (mnvr)"
        },
        "kind": "maneuver",
        "skill": "Ближний бой",
        "chance": {
          "raw": "70% (35/14), damage 1d10+DB",
          "value": 70,
          "half": 35,
          "fifth": 14
        },
        "damage": {
          "raw": "1d10+DB",
          "dice": "1d10",
          "adds_db": true
        },
        "notes": "урон автоматически повторяется в следующих раундах, пока акулу не стряхнут"
      }
    ],
    "dodge": {
      "raw": "32% (16/6)",
      "value": 32,
      "half": 16,
      "fifth": 6
    },
    "skills": [
      {
        "name": "Чутьё на кровь",
        "value": {
          "raw": "95%",
          "value": 95,
          "half": 47,
          "fifth": 19
        }
      }
    ],
    "sanity_loss": []
  },
  "abilities": [
    {
      "name": "Укус с захватом",
      "summary": "Акула вцепляется в жертву и, мотая её, автоматически наносит урон в следующих раундах, пока её не стряхнут встречной проверкой СИЛ; 10+ урона заставляют её отпустить добычу."
    }
  ],
  "description": {
    "ru": "Самая крупная хищная акула: огромная, бронированная толстой шкурой, вцепляется в жертву и терзает её.",
    "en": null
  },
  "sources": [
    {
      "book_id": "malleus-monstrorum-1-en",
      "physical_page": 196,
      "printed_page": 195,
      "method": "book_text",
      "verified": true
    }
  ],
  "corrections": [],
  "quality": {
    "needs_review": false,
    "flags": [
      "translated"
    ],
    "notes": "Колонка «Great White Shark» таблицы «Shark (Various)». Колонка «Hammerhead Shark» лучше всего соответствует существующей записи shark."
  }
}
