{
  "schema": "sourcefold.creature.v0",
  "id": "coc:creature:azathoth-xada-hgla",
  "kind": "creature",
  "name": {
    "ru": "Азатот: Ксада-Хгла",
    "en": "Azathoth: Xada-Hgla"
  },
  "aliases": [
    "Xada-Hgla",
    "Cradle of Chaos"
  ],
  "category": "avatar",
  "subcategory": "аватар Азатота",
  "axes": {
    "era": [
      "any"
    ],
    "ruleset": "core"
  },
  "statblock": {
    "averages": false,
    "characteristics": {
      "STR": {
        "raw": "600",
        "value": 600
      },
      "CON": {
        "raw": "1,150",
        "value": 1150
      },
      "SIZ": {
        "raw": "600",
        "value": 600
      },
      "DEX": {
        "raw": "50",
        "value": 50
      },
      "POW": {
        "raw": "500",
        "value": 500
      }
    },
    "hp": {
      "raw": "175",
      "value": 175
    },
    "mp": {
      "raw": "100",
      "value": 100
    },
    "damage_bonus": {
      "raw": "+14d6",
      "value": "14d6"
    },
    "build": {
      "raw": "15",
      "value": 15
    },
    "move": {
      "raw": "15",
      "value": 15,
      "modes": [
        {
          "mode": "walk",
          "value": 15
        }
      ]
    },
    "armor": {
      "raw": "50-point shell. Fleshy body within the shell (partially exposed in the gap between the two shells) has no armor and may be targeted with penalty die. If reduced to zero hit points, Xada-Hgla phases out of existence; it reforms sometime later when Azathoth dreams it.",
      "value": 50,
      "note": "раковина; мягкое тело в щели между створками без брони, атаковать его можно со штрафным кубиком; при 0 ПЗ исчезает и возрождается, когда Азатот снова увидит его во сне"
    },
    "attacks_per_round": {
      "raw": "1 (crush, grab, stomp)",
      "value": 1
    },
    "attacks": [
      {
        "name": {
          "ru": "Ближний бой (сокрушение)",
          "en": "Fighting"
        },
        "kind": "attack",
        "skill": "Ближний бой",
        "chance": {
          "raw": "100% (50/20), damage 7d6 crushing",
          "value": 100,
          "half": 50,
          "fifth": 20
        },
        "damage": {
          "raw": "7d6 crushing",
          "dice": "7d6",
          "adds_db": false
        },
        "notes": "светящиеся зелёным цилиндрические отростки"
      },
      {
        "name": {
          "ru": "Захват",
          "en": "Grab (mnvr)"
        },
        "kind": "maneuver",
        "skill": "Ближний бой",
        "chance": {
          "raw": "100% (50/20), held then pulled to body to be dissolved (see above)",
          "value": 100,
          "half": 50,
          "fifth": 20
        },
        "damage": {
          "raw": "held then pulled to body to be dissolved (see above)",
          "dice": null,
          "adds_db": false,
          "extra": "жертва втягивается в раковину и растворяется: 2d10 урона за раунд"
        },
        "notes": "вырваться — Трудная проверка ЛВК или Экстремальная СИЛ"
      },
      {
        "name": {
          "ru": "Топтание",
          "en": "Stomp"
        },
        "kind": "attack",
        "skill": "Ближний бой",
        "chance": {
          "raw": "70% (35/14), damage 14d6",
          "value": 70,
          "half": 35,
          "fifth": 14
        },
        "damage": {
          "raw": "14d6",
          "dice": "14d6",
          "adds_db": false
        },
        "notes": "по тем, кто не сумел увернуться"
      }
    ],
    "skills": [],
    "spells": {
      "raw": "none."
    },
    "sanity_loss": [
      {
        "success": "1d10",
        "fail": "5d10",
        "trigger": "при виде Ксада-Хглы"
      }
    ]
  },
  "abilities": [
    {
      "name": "Разрушение",
      "summary": "Если Ксада-Хгла полностью раскроет створки раковины, волна энергии, подобная малому ядерному взрыву, распыляет всё в радиусе 50 метров (1d100 урона), после чего аватар исчезает и позже возрождается."
    },
    {
      "name": "Растворение",
      "summary": "Схваченных втягивает внутрь раковины, где липкая жгучая плоть растворяет их (2d10 урона за раунд)."
    }
  ],
  "description": {
    "ru": "Аватар Азатота в виде двустворчатой раковины на множестве гибких ног; из щели между створками тянутся мясистые цилиндры с полипами на концах, а в темноте внутри угадывается жуткое лицо. В отличие от самого Азатота, является без свиты служителей.",
    "en": null
  },
  "legend": {
    "ru": "По преданиям насекомых с Шаггаи, Ксада-Хгла — облик, который Азатот носил до погружения в вечный сон; святилища ему есть на каждом корабле шанов, чтят его и ми-го. На Земле аватар, по общему мнению, не бывал; люди сталкиваются лишь с его идолами и святилищами.",
    "en": null
  },
  "sources": [
    {
      "book_id": "malleus-monstrorum-2-en",
      "physical_page": 39,
      "printed_page": 38,
      "method": "book_text",
      "verified": true
    }
  ],
  "corrections": [],
  "quality": {
    "needs_review": false,
    "flags": [
      "translated"
    ],
    "notes": "ИНТ в книге не указан; МОЩ взята из раздела Magic. Основное божество — coc:creature:azathoth."
  }
}
