{
  "schema": "sourcefold.creature.v0",
  "id": "lightless-beacon-ru/creature/detenysh",
  "kind": "creature",
  "name": {
    "ru": "Детёныш",
    "en": null
  },
  "aliases": [],
  "category": "mythos_monster",
  "subcategory": "глубоководный кошмар",
  "axes": {
    "era": [
      "1920s"
    ],
    "ruleset": "core"
  },
  "statblock": {
    "characteristics": {
      "STR": {
        "raw": "100",
        "value": 100
      },
      "CON": {
        "raw": "40",
        "value": 40
      },
      "SIZ": {
        "raw": "25",
        "value": 25
      },
      "DEX": {
        "raw": "80",
        "value": 80
      },
      "INT": {
        "raw": "10",
        "value": 10
      },
      "POW": {
        "raw": "40",
        "value": 40
      }
    },
    "averages": false,
    "hp": {
      "raw": "6",
      "value": 6
    },
    "mp": {
      "raw": "8",
      "value": 8
    },
    "damage_bonus": {
      "raw": "+1D4",
      "value": "1d4"
    },
    "build": {
      "raw": "1",
      "value": 1
    },
    "move": {
      "raw": "8/10 плавание",
      "value": 8,
      "modes": [
        {
          "mode": "walk",
          "value": 8
        },
        {
          "mode": "swim",
          "value": 10
        }
      ]
    },
    "attacks_per_round": {
      "raw": "1 (иглы, когти, укус)",
      "value": 1
    },
    "dodge": {
      "raw": "30% (15/6)",
      "value": 30,
      "half": 15,
      "fifth": 6
    },
    "armor": {
      "raw": "3 пункта (чешуя). Успешные атаки, направленные на глаза или живот детёныша, обходят его броню - такие «нацеленные атаки получают штрафную кость, чтобы попасть в эти конкретные области (целясь в подреберье или лицо детёныша), и могут быть предприняты только действием сыщика в бою.",
      "value": 3
    },
    "attacks": [
      {
        "name": {
          "ru": "Ближний бой",
          "en": null
        },
        "kind": "attack",
        "skill": "Ближний бой",
        "chance": {
          "raw": "40% (20/8)",
          "value": 40,
          "half": 20,
          "fifth": 8
        },
        "damage": {
          "raw": "1D3+1D4, при Чрезвычай- ном успехе атаки укусом следует 1D3 Урон от вцепления в жертву каждый последующий раунд, пока он не будет снят с помощью Трудного успеха",
          "dice": "1d3",
          "adds_db": false
        }
      },
      {
        "name": {
          "ru": "Метательная игла",
          "en": null
        },
        "kind": "attack",
        "skill": "Метательная игла",
        "chance": {
          "raw": "30% (15/6)",
          "value": 30,
          "half": 15,
          "fifth": 6
        },
        "damage": {
          "raw": "см. описание выше",
          "dice": null,
          "adds_db": false
        }
      }
    ],
    "skills": [
      {
        "name": "Чуять добычу",
        "value": {
          "raw": "50%",
          "value": 50
        }
      }
    ],
    "sanity_loss": [
      {
        "success": "1",
        "fail": "1d4",
        "trigger": "если вы видите детёныша"
      }
    ]
  },
  "abilities": [
    {
      "name": "Метательная игла",
      "summary": "у детёнышей есть метательные иглы с ядовитыми наконечниками, которые они могут выпускать спинного плавника. Цель может избежать попадания иглы, если успешно выполнит бросок на Уклонение при от- ажении атаки детёныша; однако цели, не подготовленные к атаке детёныша - обычно потому, что они не знают, что означает повернувшийся к ним спиной детёныш, - долж- ны получить штрафную кость к своему броску на Уклоне- ние. При попадании жертва должна совершить успешную Чрезвычайную проверку ВЫН, чтобы яд не подействовал на неё. Сами иглы не наносят урона, но быстродействую- щий яд вызывает помутнение и расплывчатость зрения на 1D6+1 раундов в бою, что даёт штрафную кость ко всем броскам жертвы в течение этого времени. Выстрелив од- ной иглой, детёныш переключается на атаки ближнего боя в последующие раунды. Детёныш, вцепившийся в жертву или находящийся в ближнем бою, не может использовать эту способность."
    },
    {
      "name": "Вцепиться в жертву",
      "summary": "Детёныш, успешно прошедший Чрез- вычайную проверку при атаке «Укус», вцепляется в свою жертву, нанося первоначально 1D3+1D4 урона, а затем 1D3 урона за раунд. Сыщики, успешно прошедшие Труд- ную проверку СИЛ, могут сорвать существо и отбросить его в сторону. Аналогично, другие находящиеся поблизо- сыщики, успешно совершившие Трудную проверку СИЛ, могут отцепить детёныша от своего друга. Детёныш, вцепившийся в жертву, не может уклоняться или использо- вать атаки метательными иглами."
    },
    {
      "name": "Особые способности",
      "summary": "ночное зрение – детёныш не подвержен влиянию темноты."
    }
  ],
  "sources": [
    {
      "book_id": "lightless-beacon-ru",
      "physical_page": 23,
      "printed_page": null,
      "method": "mineru",
      "verified": false
    }
  ],
  "corrections": [],
  "quality": {
    "needs_review": false,
    "flags": [],
    "notes": null
  }
}
