{
  "schema": "sourcefold.creature.v0",
  "id": "coc:creature:mummy",
  "kind": "creature",
  "name": {
    "ru": "Мумия",
    "en": "Mummy"
  },
  "aliases": [
    "Мумии"
  ],
  "category": "supernatural",
  "subcategory": "нежить",
  "axes": {
    "era": [
      "any"
    ],
    "ruleset": "core"
  },
  "statblock": {
    "characteristics": {
      "STR": {
        "raw": "100",
        "value": 100,
        "roll": "(4d6+6)×5"
      },
      "CON": {
        "raw": "80",
        "value": 80,
        "roll": "(4d6+2)×5"
      },
      "SIZ": {
        "raw": "65",
        "value": 65,
        "roll": "(2d6+6)×5"
      },
      "DEX": {
        "raw": "35",
        "value": 35,
        "roll": "2d6×5"
      },
      "INT": {
        "raw": "50–55",
        "value": 50,
        "roll": "3d6×5"
      },
      "POW": {
        "raw": "75",
        "value": 75,
        "roll": "(2d6+8)×5"
      }
    },
    "averages": true,
    "hp": {
      "raw": "14",
      "value": 14
    },
    "mp": {
      "raw": "15",
      "value": 15
    },
    "damage_bonus": {
      "raw": "+1d6",
      "value": "1d6"
    },
    "build": {
      "raw": "2",
      "value": 2
    },
    "move": {
      "raw": "6",
      "value": 6,
      "modes": [
        {
          "mode": "walk",
          "value": 6
        }
      ]
    },
    "armor": {
      "raw": "2 пункта (кожа). Проникающее оружие малоэффективно (наносит половину обычного урона); пуля наносит не более 1 пункта урона",
      "value": 2,
      "note": "кожа; проникающее оружие — половина урона, пуля — не более 1 пункта"
    },
    "attacks_per_round": {
      "raw": "2 (удар) или 1 (удушение)",
      "value": 2
    },
    "attacks": [
      {
        "name": {
          "ru": "Ближний бой",
          "en": null
        },
        "kind": "attack",
        "skill": "Ближний бой",
        "chance": {
          "raw": "70% (35/14)",
          "value": 70,
          "half": 35,
          "fifth": 14
        },
        "damage": {
          "raw": "1d6+БкУ",
          "dice": "1d6",
          "adds_db": true
        }
      },
      {
        "name": {
          "ru": "Удушение (манёвр)",
          "en": "Strangle (mnvr)"
        },
        "kind": "maneuver",
        "skill": "Ближний бой",
        "chance": {
          "raw": "процент не указан (по навыку Ближний бой)",
          "value": null,
          "half": null,
          "fifth": null
        },
        "damage": {
          "raw": "1d6+БкУ за раунд",
          "dice": "1d6",
          "adds_db": true
        },
        "notes": "обеими руками сжимает горло: урон каждый раунд, пока жертва не умрёт, не потеряет сознание или не сбросит мумию; освободиться — встречная проверка СИЛ; 6+ урона за раунд от товарищей может заставить мумию разжать хватку"
      }
    ],
    "dodge": {
      "raw": "17% (8/3)",
      "value": 17,
      "half": 8,
      "fifth": 3
    },
    "skills": [
      {
        "name": "Скрытность",
        "skill": "coc:skill:stealth",
        "value": {
          "raw": "50%",
          "value": 50
        }
      }
    ],
    "sanity_loss": [
      {
        "success": "0",
        "fail": "1d6",
        "trigger": "пунктов при виде мумии"
      }
    ]
  },
  "abilities": [
    {
      "name": "Неупокоенная плоть",
      "summary": "Как и зомби, мумию нужно изрубить на куски, чтобы она перестала действовать. Вопреки расхожему мнению, многие мумии без бинтов и двигаются довольно быстро."
    },
    {
      "name": "Уязвимость к огню",
      "summary": "Из-за битума и бинтов огонь особенно опасен для египетских мумий: первые два раунда он наносит обычный урон (1d6), а каждый следующий раунд — двойной (2d6)."
    },
    {
      "name": "Без восстановления ПМ",
      "summary": "Некоторые мумии не восстанавливают магические очки естественным путём."
    }
  ],
  "description": {
    "ru": "Разумная или полуразумная высохшая нежить, часто используемая культами как страж храма или гробницы.",
    "en": null
  },
  "sources": [
    {
      "book_id": "malleus-monstrorum-1-en",
      "physical_page": 179,
      "printed_page": 178,
      "method": "book_text",
      "verified": true
    },
    {
      "book_id": "keeper-rulebook-ru",
      "physical_page": 311,
      "printed_page": 332,
      "method": "helper_migration",
      "verified": true
    }
  ],
  "corrections": [
    {
      "field": "statblock.characteristics.STR",
      "from": "105 [3d6×10]",
      "to": "100 [(4d6+6)×5]",
      "reason": "значение по Malleus Monstrorum 7e (решение владельца Р-22)",
      "ref": "malleus-monstrorum-1-en p.178"
    },
    {
      "field": "statblock.characteristics.CON",
      "from": "80 [(3d6+2)×7]",
      "to": "80 [(4d6+2)×5]",
      "reason": "значение по Malleus Monstrorum 7e (решение владельца Р-22)",
      "ref": "malleus-monstrorum-1-en p.178"
    },
    {
      "field": "statblock.characteristics.INT",
      "from": "55 [3d6×5]",
      "to": "50–55 [3d6×5]",
      "reason": "значение по Malleus Monstrorum 7e (решение владельца Р-22)",
      "ref": "malleus-monstrorum-1-en p.178"
    },
    {
      "field": "statblock.characteristics.POW",
      "from": "75 [(1d6+12)×5]",
      "to": "75 [(2d6+8)×5]",
      "reason": "значение по Malleus Monstrorum 7e (решение владельца Р-22)",
      "ref": "malleus-monstrorum-1-en p.178"
    },
    {
      "field": "statblock.attacks_per_round",
      "from": "2",
      "to": "2 (удар) или 1 (удушение)",
      "reason": "значение по Malleus Monstrorum 7e (решение владельца Р-22)",
      "ref": "malleus-monstrorum-1-en p.178"
    },
    {
      "field": "statblock.attacks",
      "from": null,
      "to": "Удушение (манёвр), 1d6+БкУ за раунд",
      "reason": "значение по Malleus Monstrorum 7e (решение владельца Р-22)",
      "ref": "malleus-monstrorum-1-en p.178"
    },
    {
      "field": "statblock.armor",
      "from": "2 пункта (кожа). Проникающее оружие малоэффективно (наносит половину обычного урона)",
      "to": "проникающее оружие — половина урона; пуля — не более 1 пункта",
      "reason": "значение по Malleus Monstrorum 7e (решение владельца Р-22)",
      "ref": "malleus-monstrorum-1-en p.178"
    },
    {
      "field": "statblock.sanity_loss",
      "from": "1/1d8",
      "to": "0/1d6",
      "reason": "значение по Malleus Monstrorum 7e (решение владельца Р-22)",
      "ref": "malleus-monstrorum-1-en p.178"
    },
    {
      "field": "statblock.mp",
      "from": null,
      "to": "15",
      "reason": "ПМ в Malleus Monstrorum не указаны (там сказано, что некоторые мумии не восстанавливают ПМ естественным путём) — оставлено значение «Книги хранителя»",
      "ref": "keeper-rulebook-ru p.332"
    }
  ],
  "quality": {
    "needs_review": false,
    "flags": [
      "translated"
    ],
    "notes": "Процент удушения в Malleus отдельно не напечатан."
  }
}
