{
  "schema": "sourcefold.creature.v0",
  "id": "coc:creature:wailing-writher",
  "kind": "creature",
  "name": {
    "ru": "Воющий извиватель",
    "en": "The Wailing Writher"
  },
  "aliases": [
    "Narhari"
  ],
  "category": "avatar",
  "subcategory": "аватар Ньярлатхотепа",
  "axes": {
    "era": [
      "any"
    ],
    "ruleset": "core"
  },
  "statblock": {
    "characteristics": {
      "STR": {
        "raw": "250",
        "value": 250
      },
      "CON": {
        "raw": "325",
        "value": 325
      },
      "SIZ": {
        "raw": "225",
        "value": 225
      },
      "DEX": {
        "raw": "125",
        "value": 125
      },
      "POW": {
        "raw": "500",
        "value": 500
      }
    },
    "averages": false,
    "hp": {
      "raw": "55",
      "value": 55
    },
    "mp": {
      "raw": "100",
      "value": 100
    },
    "damage_bonus": {
      "raw": "+5d6",
      "value": "5d6"
    },
    "build": {
      "raw": "6",
      "value": 6
    },
    "move": {
      "raw": "18",
      "value": 18,
      "modes": [
        {
          "mode": "walk",
          "value": 18
        }
      ]
    },
    "armor": {
      "raw": "None. Immune to mundane weapons (incl. bullets).",
      "value": 0,
      "note": "иммунитет к обычному оружию; при 0 ПЗ теряет форму и становится волной чёрной слизи, из которой выходит другой облик"
    },
    "attacks_per_round": {
      "raw": "1d10 (tendril lashes) or 1 (tendril pull) or 2d3 (biting)",
      "value": null
    },
    "attacks": [
      {
        "name": {
          "ru": "Ближний бой (удары щупалец)",
          "en": "Fighting"
        },
        "kind": "attack",
        "skill": "Ближний бой",
        "chance": {
          "raw": "70% (35/14), damage 2d6",
          "value": 70,
          "half": 35,
          "fifth": 14
        },
        "damage": {
          "raw": "2d6",
          "dice": "2d6",
          "adds_db": false,
          "extra": null
        },
        "notes": "1d10 ударов щупальцами за раунд"
      },
      {
        "name": {
          "ru": "Затягивание щупальцами (манёвр)",
          "en": "Tendril pull (mnvr)"
        },
        "kind": "maneuver",
        "skill": "Ближний бой",
        "chance": {
          "raw": "70% (35/15), damage 5d6 (see above)",
          "value": 70,
          "half": 35,
          "fifth": 15
        },
        "damage": {
          "raw": "5d6 (see above)",
          "dice": "5d6",
          "adds_db": false,
          "extra": "5d6 за раунд, жертва разрывается и пожирается"
        },
        "notes": "щупальца затягивают жертву в центральное тело, где её разрывают и пожирают: 5d6 урона за раунд"
      },
      {
        "name": {
          "ru": "Укус",
          "en": "Bite"
        },
        "kind": "attack",
        "skill": "Ближний бой",
        "chance": {
          "raw": "60% (30/12), damage 1d6 (per mouth)",
          "value": 60,
          "half": 30,
          "fifth": 12
        },
        "damage": {
          "raw": "1d6 (per mouth)",
          "dice": "1d6",
          "adds_db": false,
          "extra": null
        },
        "notes": "кусает 2d3 ртами"
      }
    ],
    "skills": [],
    "spells": {
      "raw": "any the Keeper desires, but none concerning Elder God and associated matters."
    },
    "sanity_loss": [
      {
        "success": "1d8",
        "fail": "4d10",
        "trigger": "при встрече с Воющим извивателем"
      },
      {
        "success": "1",
        "fail": "1d6",
        "trigger": "вой (дополнительно к виду)"
      }
    ]
  },
  "abilities": [
    {
      "name": "Вой",
      "summary": "Безумный вой вызывает отдельную проверку рассудка (1/1d6). Обезумевшие начинают выть и бродить, могут впасть в насилие; кроме того, они проходят совмещённую проверку ВЫН и МОЩ — при провале тело распадается на атомном уровне в лужу пульсирующей плоти."
    }
  ],
  "description": {
    "ru": "Огромный столп чёрной плоти, непрерывно крутящийся и брызгающий водянистой чёрной слизью из сотен слюнявых визжащих ртов; из него выхлёстывают тысячи верёвочных щупалец, и всё вместе похоже на колонну чёрных червей.",
    "en": null
  },
  "legend": {
    "ru": "Упоминается в малоизвестных индуистских мифах — тексте «Андхере Ки Саанс» — как Нархари, «уста тьмы», что «обращает умы людей ко злу». Ему поклоняются немногочисленные Воющие.",
    "en": null
  },
  "sources": [
    {
      "book_id": "malleus-monstrorum-2-en",
      "physical_page": 164,
      "printed_page": 163,
      "method": "book_text",
      "verified": true
    },
    {
      "book_id": "malleus-monstrorum-2-en",
      "physical_page": 165,
      "printed_page": 164,
      "method": "book_text",
      "verified": true
    }
  ],
  "corrections": [],
  "quality": {
    "needs_review": false,
    "flags": [
      "translated",
      "parse_uncertain"
    ],
    "notes": "СИЛ, ВЫН, РАЗ, ЛВК, ПЗ, БкУ, комплекция и Движение — из общей таблицы «Nyarlathotep: Avatar Profiles» (стр. 164 печатн., 165 PDF); МОЩ 500, ПМ 100 и заклинания — общие атрибуты всех аватаров из той же таблицы. ИНТ в книге не указан. Опечатка в книге: у манёвра «Tendril pull» напечатано «70% (35/15)», пятая часть от 70 должна быть 14; оставлено как напечатано. Заголовок и описание — на стр. 162 печатн. (163 PDF), профиль — на стр. 163 печатн."
  }
}
